Title,Description,Longitude,Latitude,Riddle,Index,Category
Parcul Național Văcărești,https://ro.wikipedia.org/wiki/Parcul_Natural_V%C4%83c%C4%83re%C8%99ti,26.134669765003185,44.40417745810561,I se mai spune Delta dintre blocuri.,1,Natural
Grădina Botanică,https://ro.wikipedia.org/wiki/Gr%C4%83dina_Botanic%C4%83_din_Bucure%C8%99ti,26.063063338101674,44.437243921160004,Lângă Palatul Cotroceni - spectacol al naturii.,8,Natural
Spitalul Colțea,https://ro.wikipedia.org/wiki/Spitalul_Clinic_Col%C8%9Bea,26.103959013443998,44.43474194512852,Instituție medicală realizată de un domnitor fanariot.,7,Istoric
Casa Ceaușescu,https://casaceausescu.ro/?page_id=2941&lang=ro,26.09256981203704,44.47045669442872,Reședința privată a unui cuplu celebru ce a marcat istoria României.,2,Istoric
Palatul Parlamentului,https://ro.wikipedia.org/wiki/Palatul_Parlamentului,26.08728622698437,44.427809973431046,Pentru români este cea mai scumpă casă de hoți din România.,4,Istoric
